,Unnamed: 0,season_no,season_title,uploading_date,rate,time,E,title
0,0,7,Return to Africa,0,1237258,20,-1,ITCHY BOOTS  New Season: this is where I am going! 
1,1,7,Return to Africa,0,1548717,19,2,I need their help. 
2,2,7,Return to Africa,0,905116,25,3,No motorcyclists have gone here before 
3,3,7,Return to Africa,0,790900,18,4,How I ended up in a Berber village in Morocco 
4,4,7,Return to Africa,0,648198,18,5,Motorcycling solo into the Sahara Desert of Morocco 
5,5,7,Return to Africa,0,617979,18,6,I get stuck trying to cross the Saharan sand dunes of Morocco 
6,6,7,Return to Africa,0,804787,20,7,DESERT OASIS explained: this is how they do it. 
7,7,7,Return to Africa,0,598292,24,8,MORDOR lies here: in Morocco. 
8,8,7,Return to Africa,0,537552,22,9,Scaling the HIGHEST ROAD of MOROCCO 
9,9,7,Return to Africa,0,634804,19,10,Motorcycling the Atlas Mountains of Morocco gone WRONG 
10,10,7,Return to Africa,0,687796,18,11,Limping back to a Moroccan city after damaging my motorcycle 
11,11,7,Return to Africa,0,1481540,27,12,This is a serious problem with my motorcycle 
12,12,7,Return to Africa,0,693361,24,13,Crazy weather conditions in Morocco 🇲🇦 
13,13,7,Return to Africa,0,1038223,28,14,Was this even a good idea? 
14,14,7,Return to Africa,0,832947,24,15,This day in Dakhla is not panning out like I thought 
15,15,7,Return to Africa,0,547670,19,16,Crossing into MAURITANIA 
16,16,7,Return to Africa,0,597443,24,17,Changing my US dollars at the border of MAURITANIA 
17,17,7,Return to Africa,0,1342011,25,18,My bike doesn't start anymore and I’m alone in the desert of Mauritania 🇲🇷 
18,18,7,Return to Africa,0,501289,22,19,Invited by NOMADS in Mauritania for some CAMEL MILK  
19,19,7,Return to Africa,0,564071,26,20,Was this the real location of the lost city of Atlantis? Deep into the Mauritanian desert 
20,20,7,Return to Africa,0,546922,23,21,Hectic mountain climb on motorcycle to reach Richat Structure (Atlantis?) 
21,21,7,Return to Africa,0,552898,27,22,"World’s most fascinating feature, but is it Atlantis? "
22,22,7,Return to Africa,0,467336,22,23,Ancient desert library with a secret key 
23,23,7,Return to Africa,0,1250256,25,24,Brand new road already swallowed by desert in Mauritania 🇲🇷 
24,24,7,Return to Africa,0,701518,22,25,Chaos at Mauritania - Senegal land border 
25,25,7,Return to Africa,0,603899,26,26,River crossing with motorcycle to enter SENEGAL 
26,26,7,Return to Africa,0,619999,20,27,First leg of the African Continent COMPLETE - Reaching DAKAR 
27,27,7,Return to Africa,0,556912,20,28,Fixing up my bike to continue down Africa - 
28,28,7,Return to Africa,0,608969,17,29,My motorcycle is BANNED here in Senegal 🇸🇳 
29,29,7,Return to Africa,0,456796,22,30,Getting across the SALOUM DELTA in Senegal is not as easy as I thought 
30,30,7,Return to Africa,0,506538,22,31,I become a free mototaxi driver on an island in Senegal 🇸🇳 
31,31,7,Return to Africa,0,1042821,19,32,Gambian men cannot believe their eyes 🇬🇲 
32,32,7,Return to Africa,0,518285,25,33,These river crossings are getting RIDICULOUS 
33,33,7,Return to Africa,0,349501,18,34,Finding WILD Chimpanzees with Captain Hippo 
34,34,7,Return to Africa,0,460430,21,35,Will I get the right stamps to get out of The GAMBIA?! 
35,35,7,Return to Africa,0,501263,22,36,I need to speak PORTUGUESE here in GUINEA - BISSAU 
36,36,7,Return to Africa,0,440436,25,37,EPIC border crossing in Africa to enter Guinea 
37,37,7,Return to Africa,0,441979,21,38,My motorcycle and I get an absolute beating in the highlands of GUINEA 🇬🇳 
38,38,7,Return to Africa,0,667595,19,39,The INSANE escape mechanism of the Guinean People 🇬🇳  
39,39,7,Return to Africa,0,474803,20,40,My journey brings me to the edge of GUINEA 
40,40,7,Return to Africa,0,438453,20,41,Didn’t think I would enter SIERRA LEONE 🇸🇱 
41,41,7,Return to Africa,0,541270,15,42,My motorcycle has a serious problem. No help in Sierra Leone. 
42,42,7,Return to Africa,0,524676,23,43,I shouldn't have taken the single track. Off-roading Sierra Leone 🇸🇱 
43,43,7,Return to Africa,0,419483,21,44,300.000 people are digging for diamonds in Sierra Leone 🇸🇱 
44,44,7,Return to Africa,0,558778,22,45,The money is worth nothing here 🇸🇱 
45,45,7,Return to Africa,0,406494,22,46,Lebanese car mechanic trying to fix my CRF300 Rally in Liberia 
46,46,6,Project Alaska,1,4547879,19,1,I bought a new motorcycle for more Itchy Boots adventures!! 
47,47,6,Project Alaska,1,842995,19,2,Getting ready to return to South America! 
48,48,6,Project Alaska,1,1106414,19,3,Shipping my motorcycle to South America.. by plane! 
49,49,6,Project Alaska,1,745501,8,4,"Trying to get my motorcycle out of the airport in Quito, Ecuador! "
50,50,6,Project Alaska,1,857880,22,5,Motorcycle adventures in Ecuador BEGIN!! 
51,51,6,Project Alaska,1,748437,21,6,This river crossing is like BLIND ENDURO 
52,52,6,Project Alaska,1,629262,16,7,You have to pay to enter this Ecuadorian village! 
53,53,6,Project Alaska,1,686877,20,8,I hope this volcano won't erupt today! 
54,54,6,Project Alaska,1,497755,23,9,Finding the most expensive animal on Ecuadorian mountain market 
55,55,6,Project Alaska,1,959788,21,10,You are the closest to outer space on THIS place on earth! 
56,56,6,Project Alaska,1,636432,19,11,I can't believe the ingenuity of the Inca Temple of the Sun!! 
57,57,6,Project Alaska,1,1643195,23,12,Don't go to this part of Ecuador! 
58,58,6,Project Alaska,1,676229,22,13,From 4000 meters altitude straight back into the Ecuadorian JUNGLE! 
59,59,6,Project Alaska,1,580716,13,14,Ending 2021 in the AMAZON 🇪🇨 
60,60,6,Project Alaska,1,461495,19,15,I stayed with the indigenous Achuar and Shuar people of Ecuador 
61,61,6,Project Alaska,1,1233912,19,16,Crossing an amazon river with my CRF300 Rally. REALLY?! 
62,62,6,Project Alaska,1,534762,14,17,Motorcycling the mighty COTOPAXI volcano in Ecuador 
63,63,6,Project Alaska,1,1360032,26,18,Trying to cross the border into COLOMBIA 🇨🇴 
64,64,6,Project Alaska,1,1933616,19,19,"Surviving Colombia’s ""TRAMPOLINE OF DEATH"" "
65,65,6,Project Alaska,1,755381,22,20,I got my CRF300Rally stuck in mud in COLOMBIA 🇨🇴 
66,66,6,Project Alaska,1,580059,19,21,From JUNGLE into the DESERT of Colombia 🇨🇴 
67,67,6,Project Alaska,1,638356,18,22,Don’t ride off the edge!! This is Colombia 🇨🇴  
68,68,6,Project Alaska,1,671466,18,23,Not what I expected to find in these remote mountains in Colombia 🇨🇴 
69,69,6,Project Alaska,1,1166325,22,24,Attempt to cross an abandoned railway bridge in Colombia 🇨🇴 
70,70,6,Project Alaska,1,690519,23,25,My plan to cross the DARIEN GAP. 
71,71,6,Project Alaska,1,815856,24,26,A NERVE-RACKING boat ride avoiding the Darien Gap 
72,72,6,Project Alaska,1,560088,18,27,Crossing the border into PANAMA 🇵🇦 past the Darien Gap 
73,73,6,Project Alaska,1,598358,25,28,Race against time to import my motorcycle 
74,74,6,Project Alaska,1,657618,19,29,You won't believe how genius this is. 
75,75,6,Project Alaska,1,611815,26,30,How I ended up in a riverbed in the jungle of Panama 
76,76,6,Project Alaska,1,567953,19,31,I don't know what I am doing. Mountains of Panama. 
77,77,6,Project Alaska,1,727240,19,32,I am lucky to get help. 
78,78,6,Project Alaska,1,485786,20,33,They won't let me climb the volcano. 
79,79,6,Project Alaska,1,585064,22,34,Can't find the trail on this jungle island in Panama! 
80,80,6,Project Alaska,1,566868,27,35,I joined the indigenous Naso tribe of Panama 
81,81,6,Project Alaska,1,673850,18,36,Crossing into COSTA RICA 🇨🇷 
82,82,6,Project Alaska,1,551650,25,37,They won't let me get any closer - this volcano in Costa Rica just got active! 
83,83,6,Project Alaska,1,494793,20,38,I can only stay here for 20 MINUTES 
84,84,6,Project Alaska,1,608558,19,39,Crossing three rivers in Costa Rica with CROCODILES 🇨🇷 
85,85,6,Project Alaska,1,543824,24,40,Change of plans. 
86,86,6,Project Alaska,1,623607,25,41,Crossing into NICARAGUA 🇳🇮 
87,87,6,Project Alaska,1,616895,25,42,Should have better secured my bike!! Nicaragua 🇳🇮 
88,88,6,Project Alaska,1,414735,25,43,"The ancient, secret map of Nicaragua 🇳🇮 "
89,89,6,Project Alaska,1,524234,23,44,Making the impossible possible in Nicaragua 🇳🇮 
90,90,6,Project Alaska,1,716276,23,45,Nobody ever brought a motorcycle here in Nicaragua 🇳🇮 
91,91,6,Project Alaska,1,458228,24,46,Hunting for the lost city of Nicaragua with the Rama Indians 
92,92,6,Project Alaska,1,587927,22,47,First on-road surgery for my CRF300 rally! 
93,93,6,Project Alaska,1,559510,30,48,I entered an underground gold mine in Nicaragua 
94,94,6,Project Alaska,1,497902,28,49,Boarding down an active volcano in Nicaragua 
95,95,6,Project Alaska,1,432294,19,50,This is my final ride in Nicaragua 
96,96,6,Project Alaska,1,565026,20,51,Crossing the border into Honduras 
97,97,6,Project Alaska,1,5916220,27,52,They try to trap me in Honduras 🇭🇳  DANGEROUS! 
98,98,6,Project Alaska,1,660072,23,53,A mysterious cave in Honduras 🇭🇳 - The cave of the GLOWING SKULLS 
99,99,6,Project Alaska,1,590570,16,54,Forced to ride my motorcycle in the nighttime in Honduras. 
100,100,6,Project Alaska,1,904487,23,55,Nobody knows this deserted island in Honduras 🇭🇳 
101,101,6,Project Alaska,1,501601,21,56,It took me 11 hours to find this place in Honduras 🇭🇳 
102,102,6,Project Alaska,1,1311607,25,57,The biggest mystery of Honduras 🇭🇳 
103,103,6,Project Alaska,1,747356,23,58,Crossing the border Honduras - El Salvador 
104,104,6,Project Alaska,1,763504,22,59,First service HONDA CRF300Rally after 12.000 kilometers. El Salvador 🇸🇻 
105,105,6,Project Alaska,1,684802,20,60,Trying to make it out of El Salvador - one day ride to border 🇸🇻 
106,106,6,Project Alaska,1,1119215,22,61,Charly Sinewan helps me get my illegal motorcycle out of El Salvador! 
107,107,6,Project Alaska,1,1053108,22,62,I cross the border alone in GUATEMALA 
108,108,6,Project Alaska,1,611996,25,63,I have to cross these LAVA FIELDS of active Volcano Pacaya 
109,109,6,Project Alaska,1,702359,24,64,Attempt to reach Lake Atitlan in Guatemala is harder than expected 
110,110,6,Project Alaska,1,2885049,24,65,Guatemalan POLICE escorts Dutch biker and her motorcycle through area with BANDITS 
111,111,6,Project Alaska,1,1539912,28,66,More damage to my CRF300L Rally in GUATEMALA 
112,112,6,Project Alaska,1,762388,27,67,Only my motorcycle can pass here:I have to find an IXIL house in GUATEMALA 
113,113,6,Project Alaska,1,794600,28,68,An insane search on motorcycle for one lady in the mountains of GUATEMALA 
114,114,6,Project Alaska,1,1413676,23,69,I found a HIDDEN PARADISE in the mountains of GUATEMALA 
115,115,6,Project Alaska,1,633794,23,70,You won't believe this THERMAL WATERFALL in Guatemala 
116,116,6,Project Alaska,1,1924753,27,71,Solo motorcycle adventure in GUATEMALAN jungle gone wrong 
117,117,6,Project Alaska,1,993411,36,72,The long lost Mayan temples of Nakum - Motorcycling deep into Guatemalan Jungle. 
118,118,6,Project Alaska,1,788521,23,73,Crossing the GUATEMALA - BELIZE land border 
119,119,6,Project Alaska,1,661665,23,74,They won’t let me through (security cameras). Belize 🇧🇿 
120,120,6,Project Alaska,1,749793,20,75,The best petrol station of Belize 🇧🇿 (amazing system) 
121,121,6,Project Alaska,1,852317,22,76,Crossing the landborder into MEXICO 
122,122,6,Project Alaska,1,1336864,21,77,Mexican POLICE keep stopping me for questioning 
123,123,6,Project Alaska,1,645770,26,78,Riding into flooded forest in Mexico - in search for the Maya people 
124,124,6,Project Alaska,1,777527,22,79,Mexico's most dangerous road? 🇲🇽 
125,125,6,Project Alaska,1,828007,25,80,Escaping more road blocks in Mexico 🇲🇽 
126,126,6,Project Alaska,1,762270,37,81,Trying to save baby sea turtles on Mexican beach 
127,127,6,Project Alaska,1,718870,23,82,The BEST motorcycle shop of Mexico 
128,128,6,Project Alaska,1,2529213,31,83,“People with guns are blocking the road”. MEXICO 🇲🇽 
129,129,6,Project Alaska,1,658030,22,84,Mexican tunnels to secretly move the army against the invaders 
130,130,6,Project Alaska,1,676222,23,85,The biggest time telling device on Earth - in Mexico 🇲🇽 
131,131,6,Project Alaska,1,586664,22,86,I rode into a dead end canyon in Mexico 🇲🇽 
132,132,6,Project Alaska,1,956771,35,87,Motorcycling planet MARS in MEXICO (unbelievable landscape) 
133,133,6,Project Alaska,1,663847,29,88,This is not what I expected solo motorcycling through Mexico to be like 🇲🇽 
134,134,6,Project Alaska,1,691723,28,89,“The road is bad like this everywhere?” - Mexico 🇲🇽 
135,135,6,Project Alaska,1,849416,22,90,"""Don't go there, very dangerous. A lot of cartel activity"" - Mexico 🇲🇽 "
136,136,6,Project Alaska,1,2267228,27,91,Area 51 in Mexico: the ZONE of SILENCE 🇲🇽 
137,137,6,Project Alaska,1,2581185,20,92,Motorcycling Mexico's most dangerous state : Chihuahua 
138,138,6,Project Alaska,1,819735,22,93,Entering Cartel Territory - off-roading the COPPER CANYON in Mexico 
139,139,6,Project Alaska,1,693802,25,94,Getting out of Mexico's Copper Canyon into SINALOA 
140,140,6,Project Alaska,1,972420,23,95,Leaving SINALOA in Mexico during nighttime 🇲🇽 
141,141,6,Project Alaska,0,706490,22,96,Brand new aggressive offroad tires to ride BAJA - MEXICO 
142,142,6,Project Alaska,0,734603,20,97,Searching for FUEL in the BAJA CALIFORNIA desert of Mexico 
143,143,6,Project Alaska,0,762089,24,98,"I ended up in a rally through Baja, Mexico by accident "
144,144,6,Project Alaska,0,687540,27,99,They only live here for 3 months each year 
145,145,6,Project Alaska,0,1641066,28,100,Crossing MEXICO - USA 🇺🇸 land border on a motorcycle 
146,146,5,Southern Africa,2,641037,9,1,I AM BACK!! 
147,147,5,Southern Africa,2,1183511,16,2,I bought a South African motorcycle! 🇿🇦
148,148,5,Southern Africa,2,631179,12,3,Ready to hit African dirt roads 🇿🇦 
149,149,5,Southern Africa,2,580933,17,4,My first motorcycle ride in South Africa 🇿🇦 
150,150,5,Southern Africa,2,1978758,22,5,I CAN'T continue... 🇿🇦 
151,151,5,Southern Africa,2,718522,15,6,I woke up to this.. 🇿🇦
152,152,5,Southern Africa,2,540733,19,7,ADVENTURE riding some of South Africa's incredible dirt roads! 🇿🇦 
153,153,5,Southern Africa,2,481548,19,8,The BIGGEST green canyon in the world 🇿🇦 
154,154,5,Southern Africa,2,419660,20,9,2 BILLION ounces of GOLD were mined here 🇿🇦 
155,155,5,Southern Africa,2,470721,16,10,The long way round SWAZILAND 
156,156,5,Southern Africa,2,417190,22,11,Meeting the ENDANGERED cats of South Africa 🇿🇦
157,157,5,Southern Africa,2,364511,18,12,Riding through the heart of KWAZULU NATAL 🇿🇦
158,158,5,Southern Africa,2,359766,18,13,South Africa’s DRAGONS MOUNTAIN 🏔 
159,159,5,Southern Africa,2,641109,29,14,Attempt to ride Sani Pass on a Honda CRF250L - it's HECTIC!! 
160,160,5,Southern Africa,2,436335,18,15,Naude's Nek Pass - worse than Sani Pass?? 
161,161,5,Southern Africa,2,421465,19,16,I am joining a XHOSA community in South Africa 🇿🇦 
162,162,5,Southern Africa,2,275868,29,17,I went to see a Xhosa herbalist 🇿🇦 
163,163,5,Southern Africa,2,231997,26,18,Meeting the headman of a Xhosa village 
164,164,5,Southern Africa,2,331400,21,19,Riding solo back towards the mountains of SOUTH AFRICA 
165,165,5,Southern Africa,2,326292,18,20,This day turned out differently... 
166,166,5,Southern Africa,2,467729,22,21,Running out of petrol in Baviaanskloof - oh no...  
167,167,5,Southern Africa,2,380364,23,22,BACK ON THE ROAD 
168,168,5,Southern Africa,2,475443,22,23,The ROAD TO HELL on a Honda CRF250L 🇿🇦
169,169,5,Southern Africa,2,392934,19,24,Nothing is what is seems in South Africa 🇿🇦 
170,170,5,Southern Africa,2,360899,21,25,A 5.000 kilometers solo journey through South-Africa! 🇿🇦 
171,171,5,Southern Africa,2,315938,11,26,The final ride to CAPETOWN!! 🇿🇦 
172,172,5,Southern Africa,2,329930,16,27,The ghost ship FLYING DUTCHMAN still haunts these waters... 🇿🇦 
173,173,5,Southern Africa,2,334864,18,28,Why is Table mountain in Cape Town FLAT?! 
174,174,5,Southern Africa,2,2154028,23,29,I can't believe they found THIS in South Africa!! 
175,175,5,Southern Africa,2,347586,24,30,How did I end up on the BEACH?! 
176,176,5,Southern Africa,2,601827,24,31,Crossing South Africa's Karoo desert. ALONE. 
177,177,5,Southern Africa,2,337047,21,32,Why did petroleum engineers come here?! 
178,178,5,Southern Africa,2,347326,19,33,I entered Namaqualand - is this another planet? 
179,179,5,Southern Africa,2,307685,20,34,I entered South Africa's Diamond Territory 
180,180,5,Southern Africa,2,423145,23,35,How did I get myself into this situation?! 
181,181,5,Southern Africa,2,401464,20,36,190 kilometers struggle through SAND in South African desert 
182,182,5,Southern Africa,2,357908,16,37,Preparing to motorcycle NAMIBIA on my Honda CRF250L 
183,183,5,Southern Africa,2,1508312,27,38,Crossing into NAMIBIA 
184,184,5,Southern Africa,2,358656,21,39,I had to ride HARD ENDURO to get here! 
185,185,5,Southern Africa,2,408581,19,40,Shall I just do it? 
186,186,5,Southern Africa,2,362151,18,41,There are around 300 of them in Namibia! 
187,187,5,Southern Africa,2,364475,17,42,An abandoned diamond mining town in Namibia 
188,188,5,Southern Africa,2,331610,22,43,A geological illusion in Namibia 🇳🇦 
189,189,5,Southern Africa,2,369368,25,44,The day I became a Namibian cattle farmer 👩‍🌾 
190,190,5,Southern Africa,2,399321,23,45,Crossing the NAMIB DESERT 🌵
191,191,5,Southern Africa,2,410880,23,46,I have to get this fixed first! 🔧 
192,192,5,Southern Africa,2,403452,20,47,I can't believe I saw one!! So incredibly lucky! 🍀 
193,193,5,Southern Africa,2,328054,20,48,A Namibian APOCALYPSE ☠️ 
194,194,5,Southern Africa,2,414475,26,49,Caught in a sandstorm in Namibia 🇳🇦 
195,195,5,Southern Africa,1,320290,23,50,Rescuing seals stuck in fishing lines in Namibia 🦭 
196,196,5,Southern Africa,1,352142,24,51,Finding gemstones in Namibia 💎
197,197,5,Southern Africa,1,487397,25,52,One of the most inhospitable places on earth 🌏 
198,198,5,Southern Africa,1,314699,24,53,Only one plant can grow here. EXTREME NAMIBIA! 🌋 
199,199,5,Southern Africa,1,656449,22,54,Change my CRF250L for a Honda Africa Twin from 1988 with 150.000 kilometres?! 
200,200,5,Southern Africa,1,305749,20,55,Hidden secrets of Namibia! 
201,201,5,Southern Africa,1,253260,17,56,Finding Namibia's DESERT ELEPHANTS! 
202,202,5,Southern Africa,1,446148,25,57,How a little off-roading got me into trouble.. 
203,203,5,Southern Africa,1,273597,21,58,Entering Namibia's TRIBAL LANDS 
204,204,5,Southern Africa,1,2376833,21,59,How a Himba tribe reacts when they meet me 
205,205,5,Southern Africa,1,379597,17,60,Solo off-roading at the border between Namibia and Angola 
206,206,5,Southern Africa,1,306242,16,61,He wants to come with me and I say: THANK YOU! 
207,207,5,Southern Africa,1,298398,17,62,This ELEPHANT is going to CHARGE! 🐘 
208,208,5,Southern Africa,1,402064,23,63,Face to face with THREE MALE LIONS in Namibia 🦁
209,209,5,Southern Africa,1,270924,20,64,Onboard the 24/7 Anti-Poaching Unit 🦏
210,210,5,Southern Africa,1,350307,24,65,Let's change to four wheels instead of two! 
211,211,5,Southern Africa,1,265575,19,66,Crossing into BOTSWANA 
212,212,5,Southern Africa,1,283726,24,67,The realm of the ancestors. Botswana. 
213,213,5,Southern Africa,1,239508,17,68,An eerie swamp in Botswana 
214,214,5,Southern Africa,1,425223,30,69,Is it coming after me?? 🐘 
215,215,5,Southern Africa,1,402550,30,70,CAREFUL!! 
216,216,5,Southern Africa,1,417454,34,71,I raced a Dakar Rally LEGEND! 
217,217,5,Southern Africa,1,306439,21,72,The hardest place to find in Botswana! 
218,218,5,Southern Africa,1,1081258,21,73,Go off the main track and they will shoot you 
219,219,5,Southern Africa,1,1068189,18,74,Where is your permit?! 
220,220,5,Southern Africa,1,452435,20,75,The entire town is out of petrol in BOTSWANA 
221,221,5,Southern Africa,1,688944,17,76,Crossing into ZIMBABWE 
222,222,5,Southern Africa,1,271236,18,77,To the heart of ZIMBABWE 
223,223,5,Southern Africa,1,306995,21,78,Trying to eat Mopane Worms for the first time. Zimbabwe. 
224,224,5,Southern Africa,1,259611,13,79,These are the dark caves of Zimbabwe. 
225,225,5,Southern Africa,1,325194,20,80,He wants to jump on the back! 
226,226,5,Southern Africa,1,307176,20,81,These are the mountains of ZIMBABWE 
227,227,5,Southern Africa,1,281349,20,82,Got into bad weather in the Zimbabwean mountains 
228,228,5,Southern Africa,1,463257,25,83,These roads in Zimbabwe are a DISASTER 
229,229,5,Southern Africa,1,354062,22,84,Motorcycling the wild Chimanimani mountains in ZIMBABWE 
230,230,5,Southern Africa,1,380319,18,85,The best ruins I have EVER seen?!: GREAT ZIMBABWE 
231,231,5,Southern Africa,1,688366,26,86,Attempting to leave Zimbabwe - will they let me go? 
232,232,5,Southern Africa,1,2075226,23,-1,22.000 kilometer solo motorcycle journey through Africa - ITCHY BOOTS 
233,233,5,Southern Africa,1,504332,26,-1,READY for the KALAHARI RALLY?! 
234,234,5,Southern Africa,1,399974,21,-1,Itchy Boots rides Kalahari Rally 2021 - SUPER SPECIAL 
235,235,5,Southern Africa,1,306642,24,-1,Itchy Boots rides KALAHARI RALLY - Stage 1. TROUBLE EARLY ON! 
236,236,5,Southern Africa,1,349367,27,-1,Itchy Boots rides KALAHARI RALLY - Stage 2. Racing with wild horses. 
237,237,5,Southern Africa,1,315992,27,-1,Riding KALAHARI DESERT DUNES on a CRF250L - Stage 3 
238,238,5,Southern Africa,1,330551,23,-1,KTM EXC 450 vs. Honda CRF250L in KALAHARI RALLY 2021 
239,239,5,Southern Africa,1,345388,25,-1,PROBLEMS on the longest stage.. Itchy Boots rides Kalahari Rally - Stage 5 
240,240,5,Southern Africa,1,611545,16,-1,I BROKE my Honda CRF250L into two pieces. Kalahari Rally - Final Stage 6. 
241,241,5,Southern Africa,1,966940,9,-1,It's over. Itchy Boots - SEASON 5 FINALE 
242,242,4,The Dutch Moto Scene,2,392692,19,1,Itchy Boots goes mini-bike!! 
243,243,4,The Dutch Moto Scene,2,489574,23,2,Racing TT Assen on a Honda CB500x !!  
244,244,4,The Dutch Moto Scene,2,2213044,28,3,A dream come true... 
245,245,4,The Dutch Moto Scene,2,328130,21,4,Training for new adventures around the world 
246,246,4,The Dutch Moto Scene,2,377451,25,5,I learned how to motocross!! 
247,247,4,The Dutch Moto Scene,2,224785,19,6,Dutch Flattrack: the race is ON! 
248,248,4,The Dutch Moto Scene,2,591269,24,7,Itchy Boots First ride on an Electric Motorcycle as Park Ranger Assistant 
249,249,4,The Dutch Moto Scene,2,241712,18,-1,Itchy Boots CHRISTMAS SPECIAL 
250,250,4,The Dutch Moto Scene,2,1679023,26,8,I joined the POLICE ACADEMY 
251,251,4,The Dutch Moto Scene,2,423967,28,9,I can’t believe they MOTOCROSS at the POLICE ACADEMY!! 
252,252,4,The Dutch Moto Scene,2,520376,28,10,Itchy Boots tries Enduro - THIS IS HARD! 
253,253,3,"Denmark, Iceland, Norway & Sweden",2,225440,1,-1,Season 3 - SNEAK PREVIEW! 
254,254,3,"Denmark, Iceland, Norway & Sweden",2,610965,13,1,Let the adventure BEGIN! 
255,255,3,"Denmark, Iceland, Norway & Sweden",2,508726,10,2,Crossing into DENMARK 
256,256,3,"Denmark, Iceland, Norway & Sweden",2,357274,14,3,They moved the entire lighthouse!! 
257,257,3,"Denmark, Iceland, Norway & Sweden",2,509434,16,4,"Got tested, broke the door and got sick. What a day. "
258,258,3,"Denmark, Iceland, Norway & Sweden",2,467450,13,5,Passing the remote FAROE ISLANDS 
259,259,3,"Denmark, Iceland, Norway & Sweden",2,456590,14,6,I visit the Icelandic Queen of the ELVES! 
260,260,3,"Denmark, Iceland, Norway & Sweden",2,437993,16,7,Riding through horrendous weather in ICELAND 
261,261,3,"Denmark, Iceland, Norway & Sweden",2,397156,17,8,"Frozen trolls, Pseudo-Craters and Fjords - Iceland has it all!! "
262,262,3,"Denmark, Iceland, Norway & Sweden",2,433959,17,9,Motorcycling through the heart of ICELAND 
263,263,3,"Denmark, Iceland, Norway & Sweden",2,370060,17,10,To Iceland's WEST FJORDS - by boat 
264,264,3,"Denmark, Iceland, Norway & Sweden",2,484095,14,11,I've got ICELAND to myself! 
265,265,3,"Denmark, Iceland, Norway & Sweden",2,330384,17,12,I CANNOT believe this day of motorcycling Iceland!! 
266,266,3,"Denmark, Iceland, Norway & Sweden",2,333979,12,13,Game of Thrones film location in Iceland 🇮🇸 
267,267,3,"Denmark, Iceland, Norway & Sweden",2,294808,13,14,Spotting Wildlife in Iceland 🇮🇸  
268,268,3,"Denmark, Iceland, Norway & Sweden",2,346946,12,15,Iceland to Denmark with M/S Norröna 🇩🇰 
269,269,3,"Denmark, Iceland, Norway & Sweden",2,300593,11,16,Denmark has the BEST! 🇩🇰 
270,270,3,"Denmark, Iceland, Norway & Sweden",2,355792,16,17,Sweden's most mysterious  rocks 🇸🇪  
271,271,3,"Denmark, Iceland, Norway & Sweden",2,424188,14,18,This is Swedish FIKA 🇸🇪 
272,272,3,"Denmark, Iceland, Norway & Sweden",2,329428,13,19,He travels Sweden on a 150cc VESPA! 🇸🇪 
273,273,3,"Denmark, Iceland, Norway & Sweden",2,1774089,15,20,Swedish Police are the BEST! 🇸🇪 
274,274,3,"Denmark, Iceland, Norway & Sweden",2,764463,17,21,I tried World’s SMELLIEST food in Sweden 🇸🇪
275,275,3,"Denmark, Iceland, Norway & Sweden",2,542998,14,22,Solo Motorcycling the Swedish TET - Trans Euro Trail 🇸🇪 
276,276,3,"Denmark, Iceland, Norway & Sweden",2,439482,15,23,New SHOES for my Honda CB500x 🏍  
277,277,3,"Denmark, Iceland, Norway & Sweden",2,356037,19,24,Meeting Sami people in Swedish Lapland 🇸🇪  
278,278,3,"Denmark, Iceland, Norway & Sweden",2,361492,20,25,Swedish Lapland by Helicopter 🇸🇪 🚁 
279,279,3,"Denmark, Iceland, Norway & Sweden",2,1098968,17,26,"Refused at the border - Finland, NO! 🇫🇮  "
280,280,3,"Denmark, Iceland, Norway & Sweden",2,520396,15,27,700-kilometer solo motorcycle journey to NORTH CAPE 🇳🇴 
281,281,3,"Denmark, Iceland, Norway & Sweden",2,342117,14,28,"7,000 year old rock art in Norway 🇳🇴 "
282,282,3,"Denmark, Iceland, Norway & Sweden",2,387882,17,29,Discover WILD & RUGGED Norway 🇳🇴 
